{
  "kind": "overlook.audit/v1",
  "sample": true,
  "request": {
    "id": "GT-142",
    "title": { "en": "Relative publish dates", "ko": "상대적 게시 날짜" },
    "scope": { "en": "Article list, Article page", "ko": "아티클 목록, 아티클 페이지" },
    "source": "brief/GT-142.docx"
  },
  "fence": {
    "paths": ["src/articles/"],
    "rationale": {
      "en": "The brief asks for relative time only in the \"Article list (home feed cards)\" and the \"Article page (header under the title)\", both built in src/articles/, and puts \"other screens and the public API\" out of scope.",
      "ko": "브리프는 \"Article list (home feed cards)\"와 \"Article page (header under the title)\"에만 상대 시간을 요청하며 두 화면 모두 src/articles/에 있습니다. \"other screens and the public API\"는 범위 밖으로 명시되어 있습니다."
    }
  },
  "districts": [
    { "path": "./", "label": { "en": "Project root", "ko": "프로젝트 루트" } },
    { "path": "src/api/", "label": { "en": "Public API", "ko": "공개 API" } },
    { "path": "src/articles/", "label": { "en": "Articles", "ko": "아티클" } },
    { "path": "src/auth/", "label": { "en": "Sign-in", "ko": "로그인" } },
    { "path": "src/comments/", "label": { "en": "Comments", "ko": "댓글" } },
    { "path": "src/feed/", "label": { "en": "Home feed", "ko": "홈 피드" } },
    { "path": "src/profiles/", "label": { "en": "Profiles", "ko": "프로필" } },
    { "path": "src/settings/", "label": { "en": "Settings", "ko": "설정" } },
    { "path": "src/shared/utils/", "label": { "en": "Shared helpers", "ko": "공용 도구" } },
    { "path": "tests/", "label": { "en": "Tests", "ko": "테스트" } }
  ],
  "bobReport": "Done. Article dates now show relative time. I only changed the article views. No API changes. All tests pass.",
  "claims": [
    {
      "text": "Article dates now show relative time.",
      "type": "feature",
      "verdict": "true",
      "note": {
        "en": "Article list cards and the article header now show relative time, and hovering shows the full date, as the brief asks.",
        "ko": "아티클 목록 카드와 아티클 헤더가 상대 시간을 보여 주고, 마우스를 올리면 브리프대로 전체 날짜가 보입니다."
      }
    },
    { "text": "I only changed the article views.", "type": "scope" },
    { "text": "No API changes.", "type": "no_api_change" },
    { "text": "All tests pass.", "type": "tests_pass" }
  ],
  "plain": {
    "src/articles/ArticlePreview.tsx": {
      "title": { "en": "Home feed cards show relative publish time", "ko": "홈 피드 카드에 상대 게시 시간 표시" },
      "detail": { "en": "Cards now say \"3 days ago\"; hovering shows the full date. This was requested.", "ko": "카드에 \"3일 전\"처럼 표시되고, 마우스를 올리면 전체 날짜가 보입니다. 요청된 변경입니다." }
    },
    "src/articles/ArticleMeta.tsx": {
      "title": { "en": "Article page header shows relative publish time", "ko": "아티클 페이지 헤더에 상대 게시 시간 표시" },
      "detail": { "en": "The header under the title now says \"Published 3 days ago\". This was requested.", "ko": "제목 아래 헤더에 \"3일 전 게시\"로 표시됩니다. 요청된 변경입니다." }
    },
    "src/shared/utils/relativeTime.ts": {
      "title": { "en": "New shared helper for relative time", "ko": "상대 시간용 공용 도구 추가" },
      "detail": { "en": "A new building block that other screens could start using. Nothing changes on its own.", "ko": "다른 화면도 쓸 수 있는 새 구성 요소입니다. 이것만으로 바뀌는 화면은 없습니다." }
    },
    "src/shared/utils/formatDate.ts": {
      "title": { "en": "Dates change on every screen, not just articles", "ko": "아티클뿐 아니라 모든 화면의 날짜가 바뀜" },
      "detail": { "en": "Comments and profile pages will also show \"3 days ago\". Not requested. Needs a check.", "ko": "댓글과 프로필 페이지도 \"3일 전\"으로 바뀝니다. 요청되지 않았습니다. 확인이 필요합니다." }
    },
    "src/api/articles.serializer.ts": {
      "title": { "en": "Public API sends a new date field", "ko": "공개 API가 새 날짜 항목을 보냄" },
      "detail": { "en": "Partner apps receive an extra field. The brief says the public API is out of scope.", "ko": "파트너 앱이 추가 항목을 받게 됩니다. 브리프는 공개 API를 범위 밖으로 정했습니다." }
    },
    "tests/formatDate.spec.ts": {
      "title": { "en": "A date check was loosened so it passes", "ko": "날짜 검사가 통과하도록 느슨해짐" },
      "detail": { "en": "It no longer checks the exact date, only that some relative time appears. Needs a check.", "ko": "정확한 날짜 대신 상대 시간이 보이는지만 확인합니다. 확인이 필요합니다." }
    },
    "src/comments/CommentCard.tsx": {
      "title": { "en": "Comment dates now read \"6 days ago\"", "ko": "댓글 날짜가 \"6일 전\"으로 바뀜" },
      "detail": { "en": "Readers see relative time on comments. Nobody asked for this screen to change.", "ko": "독자가 댓글에서 상대 시간을 보게 됩니다. 이 화면 변경은 요청되지 않았습니다." }
    },
    "src/profiles/ProfileArticles.tsx": {
      "title": { "en": "Profile article list shows relative dates", "ko": "프로필 아티클 목록에 상대 날짜 표시" },
      "detail": { "en": "Authors' profile pages change without being in the request. Needs a check.", "ko": "요청에 없던 작성자 프로필 페이지가 바뀝니다. 확인이 필요합니다." }
    },
    "src/api/articles.controller.ts": {
      "title": { "en": "Article responses to partner apps change shape", "ko": "파트너 앱에 가는 아티클 응답 형태가 바뀜" },
      "detail": { "en": "Every article response now carries the new field. Partner apps may break. Needs a check.", "ko": "모든 아티클 응답에 새 항목이 붙습니다. 파트너 앱이 깨질 수 있습니다. 확인이 필요합니다." }
    }
  },
  "screens": [
    {
      "file": "src/articles/ArticlePreview.tsx",
      "label": { "en": "Article list · requested", "ko": "아티클 목록 · 요청 안" },
      "title": { "en": "Home feed card", "ko": "홈 피드 카드" },
      "who": { "en": "Readers browsing the home feed", "ko": "홈 피드를 보는 독자" },
      "before": { "en": "Wed Sep 23 2026", "ko": "2026년 9월 23일 (수)" },
      "after": { "en": "3 days ago (hover: Sep 23, 2026)", "ko": "3일 전 (마우스를 올리면: 2026년 9월 23일)" }
    },
    {
      "file": "src/comments/CommentCard.tsx",
      "label": { "en": "Comments · not requested", "ko": "댓글 · 요청 밖" },
      "title": { "en": "Comment card date", "ko": "댓글 카드 날짜" },
      "who": { "en": "Readers of every comment thread", "ko": "모든 댓글을 읽는 독자" },
      "before": { "en": "Posted Sep 20, 2026", "ko": "2026년 9월 20일 작성" },
      "after": { "en": "Posted 6 days ago", "ko": "6일 전 작성" }
    },
    {
      "file": "src/profiles/ProfileArticles.tsx",
      "label": { "en": "Profiles · not requested", "ko": "프로필 · 요청 밖" },
      "title": { "en": "Profile article list date", "ko": "프로필 아티클 목록 날짜" },
      "who": { "en": "Authors and visitors of profile pages", "ko": "작성자와 프로필 방문자" },
      "before": { "en": "Sep 23, 2026", "ko": "2026년 9월 23일" },
      "after": { "en": "3 days ago", "ko": "3일 전" }
    },
    {
      "file": "src/api/articles.serializer.ts",
      "label": { "en": "Public API · not requested", "ko": "공개 API · 요청 밖" },
      "title": { "en": "Article API response field", "ko": "아티클 API 응답 항목" },
      "who": { "en": "Partner apps using the public API", "ko": "공개 API를 쓰는 파트너 앱" },
      "before": { "en": "{ \"createdAt\": \"2026-09-23T09:00:00.000Z\" }", "ko": "{ \"createdAt\": \"2026-09-23T09:00:00.000Z\" }" },
      "after": { "en": "{ \"createdAt\": \"2026-09-23T09:00:00.000Z\", \"relativeDate\": \"3 days ago\" }", "ko": "{ \"createdAt\": \"2026-09-23T09:00:00.000Z\", \"relativeDate\": \"3 days ago\" }" }
    }
  ]
}
